{
  "$schema": "http://json-schema.org/draft-07/schema#",
  "$id": "https://ensina-logica.github.io/schemas/exercise.json",
  "title": "Exercise",
  "type": "object",
  "required": [
    "id",
    "theory_unit_id",
    "lesson_id",
    "type",
    "generated_by_ai",
    "prompt",
    "explanation",
    "difficulty",
    "xp_base"
  ],
  "properties": {
    "id": {
      "type": "string",
      "pattern": "^ex-sem[1-8]-[a-z-]+-[a-z0-9-]+$",
      "description": "Unique identifier: ex-sem{num}-{discipline}-{module}-{lesson}-{slug}"
    },
    "theory_unit_id": {
      "type": "string",
      "pattern": "^th-sem[1-8]-[a-z-]+-[a-z0-9-]+$",
      "description": "Must reference an existing theory unit id"
    },
    "lesson_id": {
      "type": "string",
      "pattern": "^l[0-9]{2}$"
    },
    "type": {
      "type": "string",
      "enum": ["multiple-choice", "true-false", "order-steps", "code-completion", "flashcards"]
    },
    "generated_by_ai": {
      "type": "boolean",
      "const": true,
      "description": "All exercises in MVP are AI-generated and must be verified against source"
    },
    "prompt": {
      "type": "string",
      "minLength": 10,
      "maxLength": 500
    },
    "options": {
      "type": "array",
      "items": { "type": "string" },
      "minItems": 2,
      "maxItems": 6,
      "description": "Required for multiple-choice, true-false, order-steps"
    },
    "correct": {
      "oneOf": [
        { "type": "integer", "minimum": 0 },
        { "type": "array", "items": { "type": "integer" } },
        { "type": "string" }
      ],
      "description": "Index for multiple-choice/true-false, array of indices for order-steps, mirror string for flashcards. Not used by code-completion (use blanks[].accepted_answers)."
    },
    "explanation": {
      "type": "string",
      "minLength": 20,
      "maxLength": 1000,
      "description": "Must reference the source theory unit"
    },
    "difficulty": {
      "type": "string",
      "enum": ["easy", "medium", "hard"]
    },
    "objective_id": {
      "type": "string",
      "pattern": "^OBJ-[A-Za-z0-9]+(?:-[A-Za-z0-9]+)*$",
      "description": "Objetivo do PLAN.md do módulo (ex.: OBJ-1). Obrigatório quando o módulo tem pipeline_version: 1."
    },
    "level": {
      "type": "string",
      "enum": ["reconhecer", "aplicar", "analisar", "transferir"],
      "description": "Nível cognitivo do exercício. Obrigatório quando o módulo tem pipeline_version: 1."
    },
    "source_ref": {
      "type": "string",
      "pattern": "^th-sem[1-8]-[a-z-]+-[a-z0-9-]+#[A-Za-z0-9_-]+$",
      "description": "Seção real da unidade teórica no formato '<theory_unit_id>#<section_id>'. Obrigatório quando o módulo tem pipeline_version: 1."
    },
    "answer_check": {
      "type": "string",
      "minLength": 1,
      "description": "Uma linha dizendo como a resposta foi conferida (ex.: 'Executado em Python 3.12; saída 42'). Obrigatório quando o módulo tem pipeline_version: 1."
    },
    "xp_base": {
      "type": "integer",
      "minimum": 5,
      "maximum": 50,
      "default": 10
    },
    "code": {
      "type": "string",
      "minLength": 1,
      "description": "Required for code-completion: fixed code with one or more '___' blanks (never edited by the student)."
    },
    "blanks": {
      "type": "array",
      "minItems": 1,
      "description": "Required for code-completion: one entry per '___' in 'code', in the same order.",
      "items": {
        "type": "object",
        "required": ["accepted_answers"],
        "additionalProperties": false,
        "properties": {
          "accepted_answers": {
            "type": "array",
            "minItems": 1,
            "items": { "type": "string", "minLength": 1 },
            "description": "Accepted answers for this blank. The first one is the reference answer shown on error. Compared after normalizing quotes and whitespace."
          }
        }
      }
    },
    "starter_code": {
      "type": "string",
      "description": "Required for flashcards: back of the card (answer/definition)."
    },
    "language": {
      "type": "string",
      "enum": ["javascript", "python", "pseudocode"],
      "default": "javascript"
    }
  },
  "allOf": [
    {
      "if": { "properties": { "type": { "const": "code-completion" } } },
      "then": { "required": ["code", "blanks", "language"] }
    },
    {
      "if": { "properties": { "type": { "const": "multiple-choice" } } },
      "then": { "required": ["options", "correct"] }
    },
    {
      "if": { "properties": { "type": { "const": "true-false" } } },
      "then": { "required": ["options", "correct"] }
    },
    {
      "if": { "properties": { "type": { "const": "order-steps" } } },
      "then": { "required": ["options", "correct"] }
    },
    {
      "if": { "properties": { "type": { "const": "flashcards" } } },
      "then": { "required": ["starter_code", "correct"] }
    }
  ],
  "additionalProperties": false
}