[
  {
    "id": "ex-sem1-discrete-math-m05-l522-q01",
    "theory_unit_id": "th-sem1-discrete-math-m05-l522",
    "lesson_id": "l522",
    "type": "multiple-choice",
    "generated_by_ai": true,
    "prompt": "Questão 1 sobre Funções e Relações 11: Gráfico de relação (dificuldade easy).",
    "options": [
      "Alternativa B",
      "Alternativa A",
      "Alternativa D",
      "Alternativa C"
    ],
    "correct": 1,
    "explanation": "Explicação da questão 1.",
    "difficulty": "easy",
    "xp_base": 10
  },
  {
    "id": "ex-sem1-discrete-math-m05-l522-q02",
    "theory_unit_id": "th-sem1-discrete-math-m05-l522",
    "lesson_id": "l522",
    "type": "multiple-choice",
    "generated_by_ai": true,
    "prompt": "Questão 2 sobre Funções e Relações 11: Gráfico de relação (dificuldade easy).",
    "options": [
      "Alternativa D",
      "Alternativa A",
      "Alternativa B",
      "Alternativa C"
    ],
    "correct": 2,
    "explanation": "Explicação da questão 2.",
    "difficulty": "easy",
    "xp_base": 10
  },
  {
    "id": "ex-sem1-discrete-math-m05-l522-q03",
    "theory_unit_id": "th-sem1-discrete-math-m05-l522",
    "lesson_id": "l522",
    "type": "multiple-choice",
    "generated_by_ai": true,
    "prompt": "Questão 3 sobre Funções e Relações 11: Gráfico de relação (dificuldade medium).",
    "options": [
      "Alternativa D",
      "Alternativa A",
      "Alternativa B",
      "Alternativa C"
    ],
    "correct": 1,
    "explanation": "Explicação da questão 3.",
    "difficulty": "medium",
    "xp_base": 15
  },
  {
    "id": "ex-sem1-discrete-math-m05-l522-q04",
    "theory_unit_id": "th-sem1-discrete-math-m05-l522",
    "lesson_id": "l522",
    "type": "multiple-choice",
    "generated_by_ai": true,
    "prompt": "Questão 4 sobre Funções e Relações 11: Gráfico de relação (dificuldade medium).",
    "options": [
      "Alternativa B",
      "Alternativa D",
      "Alternativa C",
      "Alternativa A"
    ],
    "correct": 3,
    "explanation": "Explicação da questão 4.",
    "difficulty": "medium",
    "xp_base": 15
  },
  {
    "id": "ex-sem1-discrete-math-m05-l522-q05",
    "theory_unit_id": "th-sem1-discrete-math-m05-l522",
    "lesson_id": "l522",
    "type": "multiple-choice",
    "generated_by_ai": true,
    "prompt": "Questão 5 sobre Funções e Relações 11: Gráfico de relação (dificuldade hard).",
    "options": [
      "Alternativa D",
      "Alternativa A",
      "Alternativa C",
      "Alternativa B"
    ],
    "correct": 3,
    "explanation": "Explicação da questão 5.",
    "difficulty": "hard",
    "xp_base": 20
  }
]