[
  {
    "id": "ex-sem1-algorithms-m07-l243-q01",
    "theory_unit_id": "th-sem1-algorithms-m07-l243",
    "lesson_id": "l243",
    "type": "multiple-choice",
    "generated_by_ai": true,
    "prompt": "Questão 1 sobre Big-O 7: Comparando complexidades (dificuldade easy).",
    "options": [
      "Alternativa A",
      "Alternativa B",
      "Alternativa D",
      "Alternativa C"
    ],
    "correct": 0,
    "explanation": "Explicação da questão 1.",
    "difficulty": "easy",
    "xp_base": 10
  },
  {
    "id": "ex-sem1-algorithms-m07-l243-q02",
    "theory_unit_id": "th-sem1-algorithms-m07-l243",
    "lesson_id": "l243",
    "type": "multiple-choice",
    "generated_by_ai": true,
    "prompt": "Questão 2 sobre Big-O 7: Comparando complexidades (dificuldade easy).",
    "options": [
      "Alternativa A",
      "Alternativa D",
      "Alternativa C",
      "Alternativa B"
    ],
    "correct": 0,
    "explanation": "Explicação da questão 2.",
    "difficulty": "easy",
    "xp_base": 10
  },
  {
    "id": "ex-sem1-algorithms-m07-l243-q03",
    "theory_unit_id": "th-sem1-algorithms-m07-l243",
    "lesson_id": "l243",
    "type": "multiple-choice",
    "generated_by_ai": true,
    "prompt": "Questão 3 sobre Big-O 7: Comparando complexidades (dificuldade medium).",
    "options": [
      "Alternativa B",
      "Alternativa A",
      "Alternativa C",
      "Alternativa D"
    ],
    "correct": 0,
    "explanation": "Explicação da questão 3.",
    "difficulty": "medium",
    "xp_base": 15
  },
  {
    "id": "ex-sem1-algorithms-m07-l243-q04",
    "theory_unit_id": "th-sem1-algorithms-m07-l243",
    "lesson_id": "l243",
    "type": "multiple-choice",
    "generated_by_ai": true,
    "prompt": "Questão 4 sobre Big-O 7: Comparando complexidades (dificuldade medium).",
    "options": [
      "Alternativa C",
      "Alternativa B",
      "Alternativa A",
      "Alternativa D"
    ],
    "correct": 0,
    "explanation": "Explicação da questão 4.",
    "difficulty": "medium",
    "xp_base": 15
  },
  {
    "id": "ex-sem1-algorithms-m07-l243-q05",
    "theory_unit_id": "th-sem1-algorithms-m07-l243",
    "lesson_id": "l243",
    "type": "multiple-choice",
    "generated_by_ai": true,
    "prompt": "Questão 5 sobre Big-O 7: Comparando complexidades (dificuldade hard).",
    "options": [
      "Alternativa A",
      "Alternativa D",
      "Alternativa C",
      "Alternativa B"
    ],
    "correct": 1,
    "explanation": "Explicação da questão 5.",
    "difficulty": "hard",
    "xp_base": 20
  }
]