[
  {
    "id": "ex-sem1-discrete-math-m09-l561-q01",
    "theory_unit_id": "th-sem1-discrete-math-m09-l561",
    "lesson_id": "l561",
    "type": "multiple-choice",
    "generated_by_ai": true,
    "prompt": "Questão 1 sobre Lógica Aplicada 2: Contradições (dificuldade easy).",
    "options": [
      "Alternativa D",
      "Alternativa B",
      "Alternativa A",
      "Alternativa C"
    ],
    "correct": 0,
    "explanation": "Explicação da questão 1.",
    "difficulty": "easy",
    "xp_base": 10
  },
  {
    "id": "ex-sem1-discrete-math-m09-l561-q02",
    "theory_unit_id": "th-sem1-discrete-math-m09-l561",
    "lesson_id": "l561",
    "type": "multiple-choice",
    "generated_by_ai": true,
    "prompt": "Questão 2 sobre Lógica Aplicada 2: Contradições (dificuldade easy).",
    "options": [
      "Alternativa C",
      "Alternativa B",
      "Alternativa A",
      "Alternativa D"
    ],
    "correct": 2,
    "explanation": "Explicação da questão 2.",
    "difficulty": "easy",
    "xp_base": 10
  },
  {
    "id": "ex-sem1-discrete-math-m09-l561-q03",
    "theory_unit_id": "th-sem1-discrete-math-m09-l561",
    "lesson_id": "l561",
    "type": "multiple-choice",
    "generated_by_ai": true,
    "prompt": "Questão 3 sobre Lógica Aplicada 2: Contradições (dificuldade medium).",
    "options": [
      "Alternativa B",
      "Alternativa C",
      "Alternativa A",
      "Alternativa D"
    ],
    "correct": 1,
    "explanation": "Explicação da questão 3.",
    "difficulty": "medium",
    "xp_base": 15
  },
  {
    "id": "ex-sem1-discrete-math-m09-l561-q04",
    "theory_unit_id": "th-sem1-discrete-math-m09-l561",
    "lesson_id": "l561",
    "type": "multiple-choice",
    "generated_by_ai": true,
    "prompt": "Questão 4 sobre Lógica Aplicada 2: Contradições (dificuldade medium).",
    "options": [
      "Alternativa A",
      "Alternativa D",
      "Alternativa B",
      "Alternativa C"
    ],
    "correct": 0,
    "explanation": "Explicação da questão 4.",
    "difficulty": "medium",
    "xp_base": 15
  },
  {
    "id": "ex-sem1-discrete-math-m09-l561-q05",
    "theory_unit_id": "th-sem1-discrete-math-m09-l561",
    "lesson_id": "l561",
    "type": "multiple-choice",
    "generated_by_ai": true,
    "prompt": "Questão 5 sobre Lógica Aplicada 2: Contradições (dificuldade hard).",
    "options": [
      "Alternativa D",
      "Alternativa B",
      "Alternativa A",
      "Alternativa C"
    ],
    "correct": 3,
    "explanation": "Explicação da questão 5.",
    "difficulty": "hard",
    "xp_base": 20
  }
]