[
  {
    "id": "ex-sem1-algorithms-m10-l280-q01",
    "theory_unit_id": "th-sem1-algorithms-m10-l280",
    "lesson_id": "l280",
    "type": "multiple-choice",
    "generated_by_ai": true,
    "prompt": "Questão 1 sobre Algoritmos Introdutórios 8: Interseção de vetores (dificuldade easy).",
    "options": [
      "Alternativa A",
      "Alternativa C",
      "Alternativa B",
      "Alternativa D"
    ],
    "correct": 3,
    "explanation": "Explicação da questão 1.",
    "difficulty": "easy",
    "xp_base": 10
  },
  {
    "id": "ex-sem1-algorithms-m10-l280-q02",
    "theory_unit_id": "th-sem1-algorithms-m10-l280",
    "lesson_id": "l280",
    "type": "multiple-choice",
    "generated_by_ai": true,
    "prompt": "Questão 2 sobre Algoritmos Introdutórios 8: Interseção de vetores (dificuldade easy).",
    "options": [
      "Alternativa D",
      "Alternativa C",
      "Alternativa A",
      "Alternativa B"
    ],
    "correct": 2,
    "explanation": "Explicação da questão 2.",
    "difficulty": "easy",
    "xp_base": 10
  },
  {
    "id": "ex-sem1-algorithms-m10-l280-q03",
    "theory_unit_id": "th-sem1-algorithms-m10-l280",
    "lesson_id": "l280",
    "type": "multiple-choice",
    "generated_by_ai": true,
    "prompt": "Questão 3 sobre Algoritmos Introdutórios 8: Interseção de vetores (dificuldade medium).",
    "options": [
      "Alternativa A",
      "Alternativa D",
      "Alternativa C",
      "Alternativa B"
    ],
    "correct": 1,
    "explanation": "Explicação da questão 3.",
    "difficulty": "medium",
    "xp_base": 15
  },
  {
    "id": "ex-sem1-algorithms-m10-l280-q04",
    "theory_unit_id": "th-sem1-algorithms-m10-l280",
    "lesson_id": "l280",
    "type": "multiple-choice",
    "generated_by_ai": true,
    "prompt": "Questão 4 sobre Algoritmos Introdutórios 8: Interseção de vetores (dificuldade medium).",
    "options": [
      "Alternativa C",
      "Alternativa A",
      "Alternativa D",
      "Alternativa B"
    ],
    "correct": 0,
    "explanation": "Explicação da questão 4.",
    "difficulty": "medium",
    "xp_base": 15
  },
  {
    "id": "ex-sem1-algorithms-m10-l280-q05",
    "theory_unit_id": "th-sem1-algorithms-m10-l280",
    "lesson_id": "l280",
    "type": "multiple-choice",
    "generated_by_ai": true,
    "prompt": "Questão 5 sobre Algoritmos Introdutórios 8: Interseção de vetores (dificuldade hard).",
    "options": [
      "Alternativa B",
      "Alternativa A",
      "Alternativa D",
      "Alternativa C"
    ],
    "correct": 2,
    "explanation": "Explicação da questão 5.",
    "difficulty": "hard",
    "xp_base": 20
  }
]