[
  {
    "id": "ex-sem1-discrete-math-m11-l585-q01",
    "theory_unit_id": "th-sem1-discrete-math-m11-l585",
    "lesson_id": "l585",
    "type": "multiple-choice",
    "generated_by_ai": true,
    "prompt": "Questão 1 sobre Resumo Integrado 2: Revisão de conjuntos (dificuldade easy).",
    "options": [
      "Alternativa D",
      "Alternativa C",
      "Alternativa B",
      "Alternativa A"
    ],
    "correct": 3,
    "explanation": "Explicação da questão 1.",
    "difficulty": "easy",
    "xp_base": 10
  },
  {
    "id": "ex-sem1-discrete-math-m11-l585-q02",
    "theory_unit_id": "th-sem1-discrete-math-m11-l585",
    "lesson_id": "l585",
    "type": "multiple-choice",
    "generated_by_ai": true,
    "prompt": "Questão 2 sobre Resumo Integrado 2: Revisão de conjuntos (dificuldade easy).",
    "options": [
      "Alternativa C",
      "Alternativa A",
      "Alternativa B",
      "Alternativa D"
    ],
    "correct": 0,
    "explanation": "Explicação da questão 2.",
    "difficulty": "easy",
    "xp_base": 10
  },
  {
    "id": "ex-sem1-discrete-math-m11-l585-q03",
    "theory_unit_id": "th-sem1-discrete-math-m11-l585",
    "lesson_id": "l585",
    "type": "multiple-choice",
    "generated_by_ai": true,
    "prompt": "Questão 3 sobre Resumo Integrado 2: Revisão de conjuntos (dificuldade medium).",
    "options": [
      "Alternativa C",
      "Alternativa B",
      "Alternativa D",
      "Alternativa A"
    ],
    "correct": 0,
    "explanation": "Explicação da questão 3.",
    "difficulty": "medium",
    "xp_base": 15
  },
  {
    "id": "ex-sem1-discrete-math-m11-l585-q04",
    "theory_unit_id": "th-sem1-discrete-math-m11-l585",
    "lesson_id": "l585",
    "type": "multiple-choice",
    "generated_by_ai": true,
    "prompt": "Questão 4 sobre Resumo Integrado 2: Revisão de conjuntos (dificuldade medium).",
    "options": [
      "Alternativa D",
      "Alternativa A",
      "Alternativa C",
      "Alternativa B"
    ],
    "correct": 2,
    "explanation": "Explicação da questão 4.",
    "difficulty": "medium",
    "xp_base": 15
  },
  {
    "id": "ex-sem1-discrete-math-m11-l585-q05",
    "theory_unit_id": "th-sem1-discrete-math-m11-l585",
    "lesson_id": "l585",
    "type": "multiple-choice",
    "generated_by_ai": true,
    "prompt": "Questão 5 sobre Resumo Integrado 2: Revisão de conjuntos (dificuldade hard).",
    "options": [
      "Alternativa D",
      "Alternativa C",
      "Alternativa B",
      "Alternativa A"
    ],
    "correct": 1,
    "explanation": "Explicação da questão 5.",
    "difficulty": "hard",
    "xp_base": 20
  }
]