[
  {
    "id": "ex-sem1-algorithms-m11-l293-q01",
    "theory_unit_id": "th-sem1-algorithms-m11-l293",
    "lesson_id": "l293",
    "type": "multiple-choice",
    "generated_by_ai": true,
    "prompt": "Questão 1 sobre Prática Integrada 9: Apresentação da solução (dificuldade easy).",
    "options": [
      "Alternativa B",
      "Alternativa A",
      "Alternativa C",
      "Alternativa D"
    ],
    "correct": 2,
    "explanation": "Explicação da questão 1.",
    "difficulty": "easy",
    "xp_base": 10
  },
  {
    "id": "ex-sem1-algorithms-m11-l293-q02",
    "theory_unit_id": "th-sem1-algorithms-m11-l293",
    "lesson_id": "l293",
    "type": "multiple-choice",
    "generated_by_ai": true,
    "prompt": "Questão 2 sobre Prática Integrada 9: Apresentação da solução (dificuldade easy).",
    "options": [
      "Alternativa D",
      "Alternativa B",
      "Alternativa A",
      "Alternativa C"
    ],
    "correct": 2,
    "explanation": "Explicação da questão 2.",
    "difficulty": "easy",
    "xp_base": 10
  },
  {
    "id": "ex-sem1-algorithms-m11-l293-q03",
    "theory_unit_id": "th-sem1-algorithms-m11-l293",
    "lesson_id": "l293",
    "type": "multiple-choice",
    "generated_by_ai": true,
    "prompt": "Questão 3 sobre Prática Integrada 9: Apresentação da solução (dificuldade medium).",
    "options": [
      "Alternativa A",
      "Alternativa D",
      "Alternativa C",
      "Alternativa B"
    ],
    "correct": 3,
    "explanation": "Explicação da questão 3.",
    "difficulty": "medium",
    "xp_base": 15
  },
  {
    "id": "ex-sem1-algorithms-m11-l293-q04",
    "theory_unit_id": "th-sem1-algorithms-m11-l293",
    "lesson_id": "l293",
    "type": "multiple-choice",
    "generated_by_ai": true,
    "prompt": "Questão 4 sobre Prática Integrada 9: Apresentação da solução (dificuldade medium).",
    "options": [
      "Alternativa D",
      "Alternativa C",
      "Alternativa B",
      "Alternativa A"
    ],
    "correct": 1,
    "explanation": "Explicação da questão 4.",
    "difficulty": "medium",
    "xp_base": 15
  },
  {
    "id": "ex-sem1-algorithms-m11-l293-q05",
    "theory_unit_id": "th-sem1-algorithms-m11-l293",
    "lesson_id": "l293",
    "type": "multiple-choice",
    "generated_by_ai": true,
    "prompt": "Questão 5 sobre Prática Integrada 9: Apresentação da solução (dificuldade hard).",
    "options": [
      "Alternativa C",
      "Alternativa D",
      "Alternativa B",
      "Alternativa A"
    ],
    "correct": 2,
    "explanation": "Explicação da questão 5.",
    "difficulty": "hard",
    "xp_base": 20
  }
]