[
  {
    "id": "ex-sem1-discrete-math-m02-f01-predicado",
    "theory_unit_id": "th-sem1-discrete-math-m02-predicates-variables",
    "lesson_id": "l14",
    "type": "flashcards",
    "generated_by_ai": true,
    "prompt": "Como se chama uma sentença que contém variáveis e só se torna proposição quando elas recebem valores?",
    "starter_code": "predicado",
    "correct": "predicado",
    "explanation": "A fonte define: “A sentence that contains variables is called a predicate.” O predicado isolado não tem valor de verdade; ele se torna proposição após substituição ou quantificação (Seção 0.2).",
    "difficulty": "easy",
    "xp_base": 5,
    "objective_id": "OBJ-1",
    "level": "reconhecer",
    "source_ref": "th-sem1-discrete-math-m02-predicates-variables#definicao",
    "answer_check": "Definição conferida na Seção 0.2: predicate = sentence that contains variables."
  },
  {
    "id": "ex-sem1-discrete-math-m02-f02-variavel-livre",
    "theory_unit_id": "th-sem1-discrete-math-m02-predicates-variables",
    "lesson_id": "l14",
    "type": "flashcards",
    "generated_by_ai": true,
    "prompt": "Como se chama a variável de um predicado que não foi especificada nem quantificada?",
    "starter_code": "variável livre",
    "correct": "variável livre",
    "explanation": "A fonte a chama de free variable: “a variable that we have not specified anything about”. É por causa dela que uma frase como “3 + x = 12” não é uma proposição (Seção 0.2).",
    "difficulty": "easy",
    "xp_base": 5,
    "objective_id": "OBJ-1",
    "level": "reconhecer",
    "source_ref": "th-sem1-discrete-math-m02-predicates-variables#definicao",
    "answer_check": "Definição conferida na Seção 0.2: free variable = variável não especificada."
  },
  {
    "id": "ex-sem1-discrete-math-m02-f03-universal",
    "theory_unit_id": "th-sem1-discrete-math-m02-quantifiers-domain",
    "lesson_id": "l15",
    "type": "flashcards",
    "generated_by_ai": true,
    "prompt": "Qual é o nome do quantificador ∀?",
    "starter_code": "quantificador universal",
    "correct": "quantificador universal",
    "explanation": "A fonte define: “The universal quantifier is ∀ and is read ‘for all’ or ‘every.’” Ele afirma que o predicado vale para todos os elementos do domínio (Seção 0.2).",
    "difficulty": "easy",
    "xp_base": 5,
    "objective_id": "OBJ-2",
    "level": "reconhecer",
    "source_ref": "th-sem1-discrete-math-m02-quantifiers-domain#definicao",
    "answer_check": "Definição conferida na Seção 0.2: ∀ = universal quantifier."
  },
  {
    "id": "ex-sem1-discrete-math-m02-f04-existencial",
    "theory_unit_id": "th-sem1-discrete-math-m02-quantifiers-domain",
    "lesson_id": "l15",
    "type": "flashcards",
    "generated_by_ai": true,
    "prompt": "Qual é o nome do quantificador ∃?",
    "starter_code": "quantificador existencial",
    "correct": "quantificador existencial",
    "explanation": "A fonte define: “The existential quantifier is ∃ and is read ‘there exists’ or ‘there is.’” Ele afirma que pelo menos um elemento do domínio satisfaz o predicado (Seção 0.2).",
    "difficulty": "easy",
    "xp_base": 5,
    "objective_id": "OBJ-2",
    "level": "reconhecer",
    "source_ref": "th-sem1-discrete-math-m02-quantifiers-domain#definicao",
    "answer_check": "Definição conferida na Seção 0.2: ∃ = existential quantifier."
  },
  {
    "id": "ex-sem1-discrete-math-m02-f05-dominio",
    "theory_unit_id": "th-sem1-discrete-math-m02-quantifiers-domain",
    "lesson_id": "l15",
    "type": "flashcards",
    "generated_by_ai": true,
    "prompt": "Como se chama o conjunto de elementos sobre os quais os quantificadores atuam?",
    "starter_code": "domínio de discurso",
    "correct": "domínio de discurso",
    "explanation": "A fonte usa a expressão domain of discourse ao perguntar se “for all x” significa todos os inteiros positivos, todos os reais ou outro conjunto. O valor de verdade de uma afirmação quantificada depende dele (Seção 0.2).",
    "difficulty": "easy",
    "xp_base": 5,
    "objective_id": "OBJ-2",
    "level": "reconhecer",
    "source_ref": "th-sem1-discrete-math-m02-quantifiers-domain#definicao",
    "answer_check": "Definição conferida na Seção 0.2: domain of discourse = conjunto sobre o qual se quantifica."
  },
  {
    "id": "ex-sem1-discrete-math-m02-f06-contraexemplo",
    "theory_unit_id": "th-sem1-discrete-math-m02-quantifiers-domain",
    "lesson_id": "l15",
    "type": "flashcards",
    "generated_by_ai": true,
    "prompt": "Como se chama um elemento do domínio que torna P(x) falsa e, assim, refuta ∀x P(x)?",
    "starter_code": "contraexemplo",
    "correct": "contraexemplo",
    "explanation": "A fonte diz que, para provar ∀xP(x) falsa, basta um exemplo de elemento para o qual P(n) é falsa: “This is often called a counterexample” (Seção 0.2, exercício 14).",
    "difficulty": "medium",
    "xp_base": 5,
    "objective_id": "OBJ-2",
    "level": "aplicar",
    "source_ref": "th-sem1-discrete-math-m02-quantifiers-domain#definicao",
    "answer_check": "Definição conferida na solução do exercício 14 da Seção 0.2."
  },
  {
    "id": "ex-sem1-discrete-math-m02-f07-negacao-quantificadores",
    "theory_unit_id": "th-sem1-discrete-math-m02-quantifier-negation",
    "lesson_id": "l21",
    "type": "flashcards",
    "generated_by_ai": true,
    "prompt": "Como se chama a regra que permite passar uma negação por ∀ ou ∃, trocando o tipo do quantificador?",
    "starter_code": "negação de quantificadores",
    "correct": "negação de quantificadores",
    "explanation": "A fonte apresenta as equivalências ¬∀xP(x) ≡ ∃x¬P(x) e ¬∃xP(x) ≡ ∀x¬P(x) e explica que a negação passa pelo quantificador, que muda de tipo (Seção 0.2, Quantifiers and Negation).",
    "difficulty": "medium",
    "xp_base": 5,
    "objective_id": "OBJ-3",
    "level": "reconhecer",
    "source_ref": "th-sem1-discrete-math-m02-quantifier-negation#definicao",
    "answer_check": "Regra conferida na Seção 0.2: a negação troca o tipo do quantificador."
  },
  {
    "id": "ex-sem1-discrete-math-m02-f08-implicito",
    "theory_unit_id": "th-sem1-discrete-math-m02-quantifier-negation",
    "lesson_id": "l21",
    "type": "flashcards",
    "generated_by_ai": true,
    "prompt": "Como se chama o quantificador que não aparece escrito, mas é recuperado pela convenção de ler variáveis livres como universalmente quantificadas?",
    "starter_code": "quantificador implícito",
    "correct": "quantificador implícito",
    "explanation": "A fonte chama a convenção de Implicit Quantifiers: sentenças com predicados e variáveis livres são entendidas como afirmações em que as variáveis são universalmente quantificadas (Seção 0.2).",
    "difficulty": "medium",
    "xp_base": 5,
    "objective_id": "OBJ-4",
    "level": "reconhecer",
    "source_ref": "th-sem1-discrete-math-m02-quantifier-negation#definicao",
    "answer_check": "Conferido na Seção 0.2, Implicit Quantifiers: a quantificação implícita é universal."
  },
  {
    "id": "ex-sem1-discrete-math-m02-f09-ordem",
    "theory_unit_id": "th-sem1-discrete-math-m02-order-deduction",
    "lesson_id": "l22",
    "type": "flashcards",
    "generated_by_ai": true,
    "prompt": "Como se chama o efeito de a posição de ∀ e ∃ alterar o significado de uma afirmação?",
    "starter_code": "ordem dos quantificadores",
    "correct": "ordem dos quantificadores",
    "explanation": "A fonte mostra que ∀x∃yP(x,y) e ∃y∀xP(x,y) não são logicamente equivalentes. A posição dos quantificadores muda o significado (Seção 3.1, Exemplo 3.1.9).",
    "difficulty": "medium",
    "xp_base": 5,
    "objective_id": "OBJ-4",
    "level": "analisar",
    "source_ref": "th-sem1-discrete-math-m02-order-deduction#definicao",
    "answer_check": "Conferido na Seção 3.1: a troca de ordem não preserva equivalência."
  },
  {
    "id": "ex-sem1-discrete-math-m02-f10-lei-logica",
    "theory_unit_id": "th-sem1-discrete-math-m02-order-deduction",
    "lesson_id": "l22",
    "type": "flashcards",
    "generated_by_ai": true,
    "prompt": "Como a fonte chama uma afirmação da lógica de predicados que é necessariamente verdadeira?",
    "starter_code": "lei da lógica",
    "correct": "lei da lógica",
    "explanation": "A fonte reserva “tautologia” para a lógica proposicional e chama de law of logic a afirmação da lógica de predicados que é necessariamente verdadeira (Seção 3.1, Beyond Propositions).",
    "difficulty": "medium",
    "xp_base": 5,
    "objective_id": "OBJ-5",
    "level": "reconhecer",
    "source_ref": "th-sem1-discrete-math-m02-order-deduction#definicao",
    "answer_check": "Definição conferida na Seção 3.1: law of logic = verdade necessária na lógica de predicados."
  }
]
