[
  {
    "id": "ex-sem1-algorithms-m06-l232-q01",
    "theory_unit_id": "th-sem1-algorithms-m06-l232",
    "lesson_id": "l232",
    "type": "multiple-choice",
    "generated_by_ai": true,
    "prompt": "Questão 1 sobre Recursão 8: Recursão vs iteração (dificuldade easy).",
    "options": [
      "Alternativa A",
      "Alternativa B",
      "Alternativa D",
      "Alternativa C"
    ],
    "correct": 2,
    "explanation": "Explicação da questão 1.",
    "difficulty": "easy",
    "xp_base": 10
  },
  {
    "id": "ex-sem1-algorithms-m06-l232-q02",
    "theory_unit_id": "th-sem1-algorithms-m06-l232",
    "lesson_id": "l232",
    "type": "multiple-choice",
    "generated_by_ai": true,
    "prompt": "Questão 2 sobre Recursão 8: Recursão vs iteração (dificuldade easy).",
    "options": [
      "Alternativa A",
      "Alternativa C",
      "Alternativa D",
      "Alternativa B"
    ],
    "correct": 1,
    "explanation": "Explicação da questão 2.",
    "difficulty": "easy",
    "xp_base": 10
  },
  {
    "id": "ex-sem1-algorithms-m06-l232-q03",
    "theory_unit_id": "th-sem1-algorithms-m06-l232",
    "lesson_id": "l232",
    "type": "multiple-choice",
    "generated_by_ai": true,
    "prompt": "Questão 3 sobre Recursão 8: Recursão vs iteração (dificuldade medium).",
    "options": [
      "Alternativa C",
      "Alternativa B",
      "Alternativa A",
      "Alternativa D"
    ],
    "correct": 2,
    "explanation": "Explicação da questão 3.",
    "difficulty": "medium",
    "xp_base": 15
  },
  {
    "id": "ex-sem1-algorithms-m06-l232-q04",
    "theory_unit_id": "th-sem1-algorithms-m06-l232",
    "lesson_id": "l232",
    "type": "multiple-choice",
    "generated_by_ai": true,
    "prompt": "Questão 4 sobre Recursão 8: Recursão vs iteração (dificuldade medium).",
    "options": [
      "Alternativa A",
      "Alternativa D",
      "Alternativa C",
      "Alternativa B"
    ],
    "correct": 2,
    "explanation": "Explicação da questão 4.",
    "difficulty": "medium",
    "xp_base": 15
  },
  {
    "id": "ex-sem1-algorithms-m06-l232-q05",
    "theory_unit_id": "th-sem1-algorithms-m06-l232",
    "lesson_id": "l232",
    "type": "multiple-choice",
    "generated_by_ai": true,
    "prompt": "Questão 5 sobre Recursão 8: Recursão vs iteração (dificuldade hard).",
    "options": [
      "Alternativa B",
      "Alternativa D",
      "Alternativa C",
      "Alternativa A"
    ],
    "correct": 3,
    "explanation": "Explicação da questão 5.",
    "difficulty": "hard",
    "xp_base": 20
  }
]