[
  {
    "id": "ex-sem1-discrete-math-m08-l556-q01",
    "theory_unit_id": "th-sem1-discrete-math-m08-l556",
    "lesson_id": "l556",
    "type": "multiple-choice",
    "generated_by_ai": true,
    "prompt": "Questão 1 sobre Provas 9: Indução forte introdutória (dificuldade easy).",
    "options": [
      "Alternativa B",
      "Alternativa A",
      "Alternativa D",
      "Alternativa C"
    ],
    "correct": 0,
    "explanation": "Explicação da questão 1.",
    "difficulty": "easy",
    "xp_base": 10
  },
  {
    "id": "ex-sem1-discrete-math-m08-l556-q02",
    "theory_unit_id": "th-sem1-discrete-math-m08-l556",
    "lesson_id": "l556",
    "type": "multiple-choice",
    "generated_by_ai": true,
    "prompt": "Questão 2 sobre Provas 9: Indução forte introdutória (dificuldade easy).",
    "options": [
      "Alternativa C",
      "Alternativa B",
      "Alternativa A",
      "Alternativa D"
    ],
    "correct": 3,
    "explanation": "Explicação da questão 2.",
    "difficulty": "easy",
    "xp_base": 10
  },
  {
    "id": "ex-sem1-discrete-math-m08-l556-q03",
    "theory_unit_id": "th-sem1-discrete-math-m08-l556",
    "lesson_id": "l556",
    "type": "multiple-choice",
    "generated_by_ai": true,
    "prompt": "Questão 3 sobre Provas 9: Indução forte introdutória (dificuldade medium).",
    "options": [
      "Alternativa C",
      "Alternativa A",
      "Alternativa D",
      "Alternativa B"
    ],
    "correct": 1,
    "explanation": "Explicação da questão 3.",
    "difficulty": "medium",
    "xp_base": 15
  },
  {
    "id": "ex-sem1-discrete-math-m08-l556-q04",
    "theory_unit_id": "th-sem1-discrete-math-m08-l556",
    "lesson_id": "l556",
    "type": "multiple-choice",
    "generated_by_ai": true,
    "prompt": "Questão 4 sobre Provas 9: Indução forte introdutória (dificuldade medium).",
    "options": [
      "Alternativa B",
      "Alternativa C",
      "Alternativa A",
      "Alternativa D"
    ],
    "correct": 0,
    "explanation": "Explicação da questão 4.",
    "difficulty": "medium",
    "xp_base": 15
  },
  {
    "id": "ex-sem1-discrete-math-m08-l556-q05",
    "theory_unit_id": "th-sem1-discrete-math-m08-l556",
    "lesson_id": "l556",
    "type": "multiple-choice",
    "generated_by_ai": true,
    "prompt": "Questão 5 sobre Provas 9: Indução forte introdutória (dificuldade hard).",
    "options": [
      "Alternativa C",
      "Alternativa A",
      "Alternativa B",
      "Alternativa D"
    ],
    "correct": 2,
    "explanation": "Explicação da questão 5.",
    "difficulty": "hard",
    "xp_base": 20
  }
]